{
  "language": "csharp",
  "root": ".",
  "edgeKinds": [
    "calls",
    "contains",
    "depends",
    "extends",
    "implements"
  ],
  "symbols": [
    {
      "id": "CallsSample.App",
      "kind": "module",
      "nativeKind": "namespace",
      "name": "App",
      "namespace": "",
      "file": "CallsSample.App/Animals.cs",
      "line": 1
    },
    {
      "id": "CallsSample.App.Animal",
      "kind": "type",
      "nativeKind": "abstract-class",
      "name": "Animal",
      "namespace": "CallsSample.App",
      "file": "CallsSample.App/Animals.cs",
      "line": 3,
      "endLine": 6,
      "visibility": "public",
      "members": []
    },
    {
      "id": "CallsSample.App.Animal..ctor()",
      "kind": "method",
      "nativeKind": "constructor",
      "name": ".ctor",
      "namespace": "",
      "file": "CallsSample.App/Animals.cs",
      "line": 3,
      "endLine": 3,
      "visibility": "protected"
    },
    {
      "id": "CallsSample.App.Animal.Speak()",
      "kind": "method",
      "nativeKind": "method",
      "name": "Speak",
      "namespace": "",
      "file": "CallsSample.App/Animals.cs",
      "line": 5,
      "endLine": 5,
      "visibility": "public"
    },
    {
      "id": "CallsSample.App.BlindSpots",
      "kind": "type",
      "nativeKind": "class",
      "name": "BlindSpots",
      "namespace": "CallsSample.App",
      "file": "CallsSample.App/BlindSpots.cs",
      "line": 8,
      "endLine": 37,
      "visibility": "public",
      "members": []
    },
    {
      "id": "CallsSample.App.BlindSpots..ctor()",
      "kind": "method",
      "nativeKind": "constructor",
      "name": ".ctor",
      "namespace": "",
      "file": "CallsSample.App/BlindSpots.cs",
      "line": 8,
      "endLine": 8,
      "visibility": "public"
    },
    {
      "id": "CallsSample.App.BlindSpots.BuildGenericType(Type,Type)",
      "kind": "method",
      "nativeKind": "method",
      "name": "BuildGenericType",
      "namespace": "",
      "file": "CallsSample.App/BlindSpots.cs",
      "line": 20,
      "endLine": 23,
      "visibility": "public",
      "dynamic": [
        {
          "kind": "make-type",
          "line": 22
        }
      ]
    },
    {
      "id": "CallsSample.App.BlindSpots.CreateTwice(Type)",
      "kind": "method",
      "nativeKind": "method",
      "name": "CreateTwice",
      "namespace": "",
      "file": "CallsSample.App/BlindSpots.cs",
      "line": 31,
      "endLine": 36,
      "visibility": "public",
      "dynamic": [
        {
          "kind": "create",
          "line": 33
        },
        {
          "kind": "create",
          "line": 34
        }
      ]
    },
    {
      "id": "CallsSample.App.BlindSpots.CreateViaActivator(Type)",
      "kind": "method",
      "nativeKind": "method",
      "name": "CreateViaActivator",
      "namespace": "",
      "file": "CallsSample.App/BlindSpots.cs",
      "line": 10,
      "endLine": 13,
      "visibility": "public",
      "dynamic": [
        {
          "kind": "create",
          "line": 12
        }
      ]
    },
    {
      "id": "CallsSample.App.BlindSpots.DynamicCallInLambda(dynamic)",
      "kind": "method",
      "nativeKind": "method",
      "name": "DynamicCallInLambda",
      "namespace": "",
      "file": "CallsSample.App/BlindSpots.cs",
      "line": 25,
      "endLine": 29,
      "visibility": "public",
      "dynamic": [
        {
          "kind": "dynamic",
          "line": 27
        }
      ]
    },
    {
      "id": "CallsSample.App.BlindSpots.InvokeViaReflection(MethodInfo,object)",
      "kind": "method",
      "nativeKind": "method",
      "name": "InvokeViaReflection",
      "namespace": "",
      "file": "CallsSample.App/BlindSpots.cs",
      "line": 15,
      "endLine": 18,
      "visibility": "public",
      "dynamic": [
        {
          "kind": "invoke",
          "line": 17
        }
      ]
    },
    {
      "id": "CallsSample.App.Calculator",
      "kind": "type",
      "nativeKind": "class",
      "name": "Calculator",
      "namespace": "CallsSample.App",
      "file": "CallsSample.App/Calculator.cs",
      "line": 3,
      "endLine": 20,
      "visibility": "public",
      "members": []
    },
    {
      "id": "CallsSample.App.Calculator..ctor()",
      "kind": "method",
      "nativeKind": "constructor",
      "name": ".ctor",
      "namespace": "",
      "file": "CallsSample.App/Calculator.cs",
      "line": 3,
      "endLine": 3,
      "visibility": "public"
    },
    {
      "id": "CallsSample.App.Calculator.Add(int,int)",
      "kind": "method",
      "nativeKind": "method",
      "name": "Add",
      "namespace": "",
      "file": "CallsSample.App/Calculator.cs",
      "line": 7,
      "endLine": 7,
      "visibility": "public"
    },
    {
      "id": "CallsSample.App.Calculator.Add(int,int,int)",
      "kind": "method",
      "nativeKind": "method",
      "name": "Add",
      "namespace": "",
      "file": "CallsSample.App/Calculator.cs",
      "line": 9,
      "endLine": 9,
      "visibility": "public"
    },
    {
      "id": "CallsSample.App.Calculator.Identity`1(T)",
      "kind": "method",
      "nativeKind": "method",
      "name": "Identity",
      "namespace": "",
      "file": "CallsSample.App/Calculator.cs",
      "line": 13,
      "endLine": 13,
      "visibility": "public"
    },
    {
      "id": "CallsSample.App.Calculator.UseIdentity()",
      "kind": "method",
      "nativeKind": "method",
      "name": "UseIdentity",
      "namespace": "",
      "file": "CallsSample.App/Calculator.cs",
      "line": 15,
      "endLine": 19,
      "visibility": "public"
    },
    {
      "id": "CallsSample.App.ChainCtor",
      "kind": "type",
      "nativeKind": "class",
      "name": "ChainCtor",
      "namespace": "CallsSample.App",
      "file": "CallsSample.App/Misc.cs",
      "line": 46,
      "endLine": 59,
      "visibility": "public",
      "members": [
        {
          "kind": "field",
          "name": "Seed",
          "type": "int",
          "visibility": "public"
        }
      ],
      "memberLines": {
        "Seed": 58
      }
    },
    {
      "id": "CallsSample.App.ChainCtor..ctor()",
      "kind": "method",
      "nativeKind": "constructor",
      "name": ".ctor",
      "namespace": "",
      "file": "CallsSample.App/Misc.cs",
      "line": 48,
      "endLine": 51,
      "visibility": "public"
    },
    {
      "id": "CallsSample.App.ChainCtor..ctor(int)",
      "kind": "method",
      "nativeKind": "constructor",
      "name": ".ctor",
      "namespace": "",
      "file": "CallsSample.App/Misc.cs",
      "line": 53,
      "endLine": 56,
      "visibility": "public"
    },
    {
      "id": "CallsSample.App.Circle",
      "kind": "type",
      "nativeKind": "class",
      "name": "Circle",
      "namespace": "CallsSample.App",
      "file": "CallsSample.App/Shapes.cs",
      "line": 8,
      "endLine": 13,
      "visibility": "public",
      "members": [
        {
          "kind": "field",
          "name": "Radius",
          "type": "double",
          "visibility": "public"
        }
      ],
      "memberLines": {
        "Radius": 10
      }
    },
    {
      "id": "CallsSample.App.Circle..ctor()",
      "kind": "method",
      "nativeKind": "constructor",
      "name": ".ctor",
      "namespace": "",
      "file": "CallsSample.App/Shapes.cs",
      "line": 8,
      "endLine": 8,
      "visibility": "public"
    },
    {
      "id": "CallsSample.App.Circle.Area()",
      "kind": "method",
      "nativeKind": "method",
      "name": "Area",
      "namespace": "",
      "file": "CallsSample.App/Shapes.cs",
      "line": 12,
      "endLine": 12,
      "visibility": "public"
    },
    {
      "id": "CallsSample.App.Dog",
      "kind": "type",
      "nativeKind": "class",
      "name": "Dog",
      "namespace": "CallsSample.App",
      "file": "CallsSample.App/Animals.cs",
      "line": 10,
      "endLine": 13,
      "visibility": "public",
      "members": []
    },
    {
      "id": "CallsSample.App.Dog..ctor()",
      "kind": "method",
      "nativeKind": "constructor",
      "name": ".ctor",
      "namespace": "",
      "file": "CallsSample.App/Animals.cs",
      "line": 10,
      "endLine": 10,
      "visibility": "public"
    },
    {
      "id": "CallsSample.App.Dog.Speak()",
      "kind": "method",
      "nativeKind": "method",
      "name": "Speak",
      "namespace": "",
      "file": "CallsSample.App/Animals.cs",
      "line": 12,
      "endLine": 12,
      "visibility": "public"
    },
    {
      "id": "CallsSample.App.Factory",
      "kind": "type",
      "nativeKind": "static-class",
      "name": "Factory",
      "namespace": "CallsSample.App",
      "file": "CallsSample.App/Shapes.cs",
      "line": 36,
      "endLine": 43,
      "visibility": "public",
      "members": []
    },
    {
      "id": "CallsSample.App.Factory.MakeCircle(double)",
      "kind": "method",
      "nativeKind": "method",
      "name": "MakeCircle",
      "namespace": "",
      "file": "CallsSample.App/Shapes.cs",
      "line": 42,
      "endLine": 42,
      "visibility": "public"
    },
    {
      "id": "CallsSample.App.IShape",
      "kind": "interface",
      "nativeKind": "interface",
      "name": "IShape",
      "namespace": "CallsSample.App",
      "file": "CallsSample.App/Shapes.cs",
      "line": 3,
      "endLine": 6,
      "visibility": "public",
      "members": [
        {
          "kind": "method",
          "name": "Area",
          "type": "double Area()",
          "visibility": "public"
        }
      ],
      "memberLines": {
        "Area": 5
      }
    },
    {
      "id": "CallsSample.App.IShape.Area()",
      "kind": "method",
      "nativeKind": "method",
      "name": "Area",
      "namespace": "",
      "file": "CallsSample.App/Shapes.cs",
      "line": 5,
      "endLine": 5,
      "visibility": "public"
    },
    {
      "id": "CallsSample.App.LambdaHost",
      "kind": "type",
      "nativeKind": "class",